input,answer
"Context: The way to come up with good startup ideas is to take a step back.
Instead of making a conscious effort to think of startup ideas,
turn your mind into the type that startup ideas form in without any
conscious effort.  In fact, so unconsciously that you don't even
realize at first that they're startup ideas. This is not only possible, it's how Apple, Yahoo, Google, and
Facebook all got started.  None of these companies were even meant
to be companies at first.  They were all just side projects.  The
best startups almost have to start as side projects, because great
ideas tend to be such outliers that your conscious mind would reject
them as ideas for companies

Question: In the following Paul Graham passage, what does he say about 'Instead of making a conscious'?
Answer:","Instead of making a conscious effort to think of startup ideas,
turn your mind into the type that startup ideas form in without any
conscious effort"
"Context:  About 20% of the
startups we've funded have had a founder leave.  It happens so often
that we've reversed our attitude to vesting.  We still don't require
it, but now we advise founders to vest so there will be an orderly
way for people to quit. A founder leaving doesn't necessarily kill a startup, though.  Plenty
of successful startups have had that happen. [ 11 ] Fortunately it's
usually the least committed founder who leaves.  If there are three
founders and one who was lukewarm leaves, big deal.  If you have
two and one leaves, or a guy with critical technical skills leaves,
that's more of a problem.  But even that is survivable.  Blogger
got down to one person, and they bounced back

Question: In the following Paul Graham passage, what does he say about 'We still don't require it,'?
Answer:","We still don't require
it, but now we advise founders to vest so there will be an orderly
way for people to quit"
"Context:  For over a decade, every hacker who'd ever
had to process payments online knew how painful the experience was.
Thousands of people must have known about this problem.  And yet
when they started startups, they decided to build recipe sites, or
aggregators for local events.  Why?  Why work on problems few care
much about and no one will pay for, when you could fix one of the
most important components of the world's infrastructure?  Because
schlep blindness prevented people from even considering the idea
of fixing payments. Probably no one who applied to Y Combinator to work on a recipe
site began by asking ""should we fix payments, or build a recipe
site?"" and chose the recipe site

Question: In the following Paul Graham passage, what does he say about 'Probably no one who applied'?
Answer:","Probably no one who applied to Y Combinator to work on a recipe
site began by asking ""should we fix payments, or build a recipe
site?"" and chose the recipe site"
"Context: Afterward
you realize that using the new operator would simplify the design  
of another part of the program, and so on.
Language and program evolve together.
Like the border between two warring states,
the boundary between language and program is drawn and redrawn,
until eventually it comes to rest along the mountains and rivers,
the natural frontiers of your problem.
In the end your program will look as if the language had been
designed for it.
And when language and
program fit one another well, you end up with code which is
clear, small, and efficient. It's worth emphasizing that bottom-up design doesn't mean
just writing the same program in a different order

Question: In the following Paul Graham passage, what does he say about 'It's worth emphasizing that bottom-up'?
Answer:","It's worth emphasizing that bottom-up design doesn't mean
just writing the same program in a different order"
"Context:  He walks right by them, dressed up as an
old man on crutches, and they never suspect him. Our secret weapon was similar.  We wrote our software in a weird
AI language, with a bizarre syntax full of parentheses.  For years
it had annoyed me to hear Lisp described that way.  But now it
worked to our advantage.  In business, there is nothing more valuable
than a technical advantage your competitors don't understand.  In
business, as in war, surprise is worth as much as force. And so, I'm a little embarrassed to say, I never said anything
publicly about Lisp while we were working on Viaweb

Question: In the following Paul Graham passage, what does he say about 'In business, as in war,'?
Answer:","In
business, as in war, surprise is worth as much as force"
"Context:  If a filter has never seen the
token ""xxxporn"" before it will have an individual spam
probability of .4, whereas ""xxx"" and ""porn"" individually
have probabilities (in my corpus) of .9889 and .99
respectively, and a combined probability of .9998. I expect decomposing domain names to become more
important as spammers are gradually forced to stop using
incriminating words in the text of their messages.  (A url
with an ip address is of course an extremely incriminating sign,
except in the mail of a few sysadmins.) It might be a good idea to have a cooperatively maintained
list of urls promoted by spammers

Question: In the following Paul Graham passage, what does he say about '4, whereas ""xxx"" and ""porn""'?
Answer:","4, whereas ""xxx"" and ""porn"" individually
have probabilities (in my corpus) of"
"Context: At Viaweb we were forced to operate like a consulting company
initially, because we were so desperate for users that we'd offer
to build merchants' sites for them if they'd sign up. 
But we never charged for such work, because we didn't want them to
start treating us like actual consultants, and calling us every
time they wanted something changed on their site.  We knew we had
to stay a product company, because only
that scales. 8. Avoid inexperienced investors. Though novice investors seem unthreatening they can be the most
dangerous sort, because they're so nervous.  Especially in
proportion to the amount they invest

Question: In the following Paul Graham passage, what does he say about 'Especially in proportion to the'?
Answer:","Especially in
proportion to the amount they invest"
"Context: Thanks to Sarah Harlin for reading drafts of this; Daniel Giffin (who is 
also writing the production Arc interpreter) for several good ideas about
filtering and for creating our mail infrastructure; Robert Morris,
Trevor Blackwell and Erann Gat for many discussions about spam; Raph 
Levien for advice about trust metrics;  and Chip Coldwell 
and Sam Steingold for advice about statistics. You'll find this essay and 14 others in Hackers & Painters . More Info:

Question: In the following Paul Graham passage, what does he say about 'You'll find this essay and'?
Answer:",You'll find this essay and 14 others in Hackers & Painters
"Context: [ 2 ] In fact, it may be good for angels that there are more people doing
angel-sized deals, because if angel rounds become more legitimate,
then startups may start to opt for angel rounds even when they
could, if they wanted, raise series A rounds from VCs.  One reason
startups prefer series A rounds is that they're more prestigious.
But if angel investors become more active and better known, they'll
increasingly be able to compete with VCs in brand. Of course, prestige isn't the main reason to prefer a series A
round.  A startup will probably get more attention from investors
in a series A round than an angel round

Question: In the following Paul Graham passage, what does he say about 'One reason startups prefer series'?
Answer:","One reason
startups prefer series A rounds is that they're more prestigious"
"Context:  But adding this ability
to raw brainpower is like adding tin to copper.  The result is
bronze, which is so much harder that it seems a different metal. A hacker who has learned what to make, and not just how to make,
is extraordinarily powerful.  And not just at making money: look
what a small group of volunteers has achieved with Firefox. Doing an Artix teaches you to make something people want in the
same way that not drinking anything would teach you how much you
depend on water.  But it would be more convenient for all involved
if the Summer Founders didn't learn this on our dime—if they could
skip the Artix phase and go right on to make something customers
wanted

Question: In the following Paul Graham passage, what does he say about 'A hacker who has learned'?
Answer:","A hacker who has learned what to make, and not just how to make,
is extraordinarily powerful"
"Context:  The
Pebbles assembled the first several hundred watches themselves. If
they hadn't gone through that phase, they probably wouldn't have
sold $10 million worth of watches when they did go on Kickstarter. Like paying excessive attention to early customers, fabricating
things yourself turns out to be valuable for hardware startups.
You can tweak the design faster when you're the factory, and you
learn things you'd never have known otherwise

Question: In the following Paul Graham passage, what does he say about 'The Pebbles assembled the first'?
Answer:","The
Pebbles assembled the first several hundred watches themselves"
"Context: Bring Back Moore's Law The last 10 years have reminded us what Moore's Law actually says.
Till about 2002 you could safely misinterpret it as promising that
clock speeds would double every 18 months.  Actually what it says
is that circuit densities will double every 18 months.  It used to
seem pedantic to point that out.  Not any more.  Intel can no longer
give us faster CPUs, just more of them. This Moore's Law is not as good as the old one

Question: In the following Paul Graham passage, what does he say about 'Bring Back Moore's Law The'?
Answer:",Bring Back Moore's Law The last 10 years have reminded us what Moore's Law actually says
"Context:  But in general, for
application software, you want to be using the most powerful
(reasonably efficient) language you can get, and using anything
else is a mistake, of exactly the same kind, though possibly in a
lesser degree, as programming in machine language. You can see that machine language is very low level.  But, at least
as a kind of social convention, high-level languages are often all
treated as equivalent.  They're not.  Technically the term ""high-level
language"" doesn't mean anything very definite.  There's no dividing
line with machine languages on one side and all the high-level
languages on the other

Question: In the following Paul Graham passage, what does he say about 'You can see that machine'?
Answer:",You can see that machine language is very low level
"Context:  You can find groups near you through the Angel Capital Association . [ 3 ] However, most angel investors don't belong to these groups.  In
fact, the more prominent the angel, the less likely they are to
belong to a group. Some angel groups charge you money to pitch your idea to them.
Needless to say, you should never do this. One of the dangers of taking investment from individual angels,
rather than through an angel group or investment firm, is that they
have less reputation to protect.  A big-name VC firm will not screw
you too outrageously, because other founders would avoid them if
word got out.  With individual angels you don't have this protection,
as we found to our dismay in our own startup

Question: In the following Paul Graham passage, what does he say about 'A big-name VC firm will'?
Answer:","A big-name VC firm will not screw
you too outrageously, because other founders would avoid them if
word got out"
"Context:  So when you're not in fundraising mode, you should take
money from investors only if they require no convincing, and are
willing to invest on terms you'll take without negotiation.  For
example, if a reputable investor is willing to invest on a convertible
note, using standard paperwork, that is either uncapped or capped
at a good valuation, you can take that without having to think. [ 3 ] The terms will be whatever they turn out to be in your next
equity round.  And ""no convincing"" means just that: zero time spent
meeting with investors or preparing materials for them

Question: In the following Paul Graham passage, what does he say about 'So when you're not in'?
Answer:","So when you're not in fundraising mode, you should take
money from investors only if they require no convincing, and are
willing to invest on terms you'll take without negotiation"
"Context: How do you find users to recruit manually?  If you build something
to solve your own problems , then
you only have to find your peers, which is usually straightforward.
Otherwise you'll have to make a more deliberate effort to locate
the most promising vein of users.  The usual way to do that is to
get some initial set of users by doing a comparatively untargeted
launch, and then to observe which kind seem most enthusiastic, and
seek out more like them.  For example, Ben Silbermann noticed that
a lot of the earliest Pinterest users were interested in design,
so he went to a conference of design bloggers to recruit users, and
that worked well

Question: In the following Paul Graham passage, what does he say about 'How do you find users'?
Answer:","How do you find users to recruit manually?  If you build something
to solve your own problems , then
you only have to find your peers, which is usually straightforward"
"Context:  It was easy to
tell how smart they were, and most people reading this will be over
that threshold.  The hard part was predicting how tough and ambitious they would become.  There
may be no one who has more experience at trying to predict that,
so I can tell you how much an expert can know about it, and the
answer is: not much.  I learned to keep a completely open mind about
which of the startups in each batch would turn out to be the stars. The founders sometimes think they know. Some arrive feeling sure
they will ace Y Combinator just as they've aced every one of the (few,
artificial, easy) tests they've faced in life so far

Question: In the following Paul Graham passage, what does he say about 'I learned to keep a'?
Answer:","I learned to keep a completely open mind about
which of the startups in each batch would turn out to be the stars"
"Context: I explained this as code to show a couple of important details.
I want to bias the probabilities slightly to avoid false
positives, and by trial and error I've found that a good
way to do it is to double all the numbers in good .
This helps to distinguish between words that occasionally
do occur in legitimate email and words that almost never do. 
I only consider words that occur more than five times in
total (actually, because of the doubling, occurring three 
times in nonspam mail would be enough).  And then there is
the question of what probability to assign to words that
occur in one corpus but not the other.  Again by trial and   
error I chose .01 and .99

Question: In the following Paul Graham passage, what does he say about 'I explained this as code'?
Answer:",I explained this as code to show a couple of important details
"Context:  The question is not whether
you need it, but whether it brings any advantage at all.
Because anything that brings an advantage will give your competitors
an advantage over you if they do it and you don't.  So if you hear
someone saying ""we don't need to be in Silicon Valley,"" that use
of the word ""need"" is a sign they're not even thinking about the
question right. And while startup hubs are as powerful magnets as ever, the increasing
cheapness of starting a startup means the particles they're attracting
are getting lighter.  A startup now can be just a pair of 22 year
old guys.  A company like that can move much more easily than one
with 10 people, half of whom have kids

Question: In the following Paul Graham passage, what does he say about 'A company like that can'?
Answer:","A company like that can move much more easily than one
with 10 people, half of whom have kids"
"Context:  There are plenty of people
as smart as Bill Gates who achieve nothing. In most domains, talent is overrated compared to determination—partly
because it makes a better story, partly because it gives onlookers
an excuse for being lazy, and partly because after a while determination
starts to look like talent. I can't think of any field in which determination is overrated, but
the relative importance of determination and talent probably do
vary somewhat.  Talent probably matters more in types of work that
are purer, in the sense that one is solving mostly a single type
of problem instead of many different types

Question: In the following Paul Graham passage, what does he say about 'In most domains, talent is'?
Answer:","In most domains, talent is overrated compared to determination—partly
because it makes a better story, partly because it gives onlookers
an excuse for being lazy, and partly because after a while determination
starts to look like talent"
"Context:  If you find yourself saying a sentence that
ends with ""but we're going to keep working on the startup,"" you are
in big trouble.  Bob's going to grad school, but we're going to
keep working on the startup.  We're moving back to Minnesota, but
we're going to keep working on the startup.  We're taking on some
consulting projects, but we're going to keep working on the startup.
You may as well just translate these to ""we're giving up on the
startup, but we're not willing to admit that to ourselves,"" because
that's what it means most of the time.  A startup is so hard that
working on it can't be preceded by ""but."" In particular, don't go to graduate school, and don't start other
projects

Question: In the following Paul Graham passage, what does he say about 'A startup is so hard'?
Answer:","A startup is so hard that
working on it can't be preceded by ""but"
"Context: In Robert's defense, he was skeptical about Artix.  I dragged him
into it. [ 3 ] But there were moments when he was optimistic.  And
if we, who were 29 and 30 at the time, could get excited about such
a thoroughly boneheaded idea, we should not be surprised that hackers
aged 21 or 22 are pitching us ideas with little hope of making money. The Still Life Effect Why does this happen?  Why do good hackers have bad business ideas? Let's look at our case.  One reason we had such a lame idea was
that it was the first thing we thought of.  I was in New York trying
to be a starving artist at the time (the starving part is actually
quite easy), so I was haunting galleries anyway

Question: In the following Paul Graham passage, what does he say about '[ 3 ] But there'?
Answer:",[ 3 ] But there were moments when he was optimistic
"Context:  And then a second later I realized that without
Julian, Viaweb would never have made it.  So even though it was a
good deal for him, it was a good deal for us too.  That's why I
knew there was room for something like Y Combinator. Initially we didn't have what turned out to be the most important
idea: funding startups synchronously, instead of asynchronously as
it had always been done before.  Or rather we had the idea, but we
didn't realize its significance.  We decided very early 
that the first thing we'd do would
be to fund a bunch of startups over the coming summer.  But we
didn't realize initially that this would be the way we'd do all our
investing

Question: In the following Paul Graham passage, what does he say about 'Initially we didn't have what'?
Answer:","Initially we didn't have what turned out to be the most important
idea: funding startups synchronously, instead of asynchronously as
it had always been done before"
"Context:  Users
train the search: you can start out finding matches based on mere
textual similarity, and as users buy more stuff the search results
get better and better. Jerry didn't seem to care.  I was confused.  I was showing him
technology that extracted the maximum value from search traffic,
and he didn't care?  I couldn't tell whether I was explaining it
badly, or he was just very poker faced. I didn't realize the answer till later, after I went to work at
Yahoo.  It was neither of my guesses.  The reason Yahoo didn't care
about a technique that extracted the full value of traffic was that
advertisers were already overpaying for it.  If Yahoo merely extracted
the actual value, they'd have made less

Question: In the following Paul Graham passage, what does he say about 'Users train the search: you'?
Answer:","Users
train the search: you can start out finding matches based on mere
textual similarity, and as users buy more stuff the search results
get better and better"
"Context:  Python copies even features
that many Lisp hackers consider to be mistakes.
You could translate simple Lisp programs into Python line for line.
It's 2002, and programming languages have almost caught up 
with 1958. Catching Up with Math What I mean is that
Lisp was first discovered by John McCarthy in 1958,
and popular programming languages are only now
catching up with the ideas he developed then. Now, how could that be true?  Isn't computer technology something
that changes very rapidly?  I mean, in 1958, computers were
refrigerator-sized behemoths with the processing power of    
a wristwatch

Question: In the following Paul Graham passage, what does he say about 'Now, how could that be'?
Answer:","Now, how could that be true?  Isn't computer technology something
that changes very rapidly?  I mean, in 1958, computers were
refrigerator-sized behemoths with the processing power of    
a wristwatch"
"Context: [ 6 ] Some super-angels seem to care about valuations.  Several turned
down YC-funded startups after Demo Day because their valuations
were too high.  This was not a problem for the startups; by definition
a high valuation means enough investors were willing to accept it.
But it was mysterious to me that the super-angels would quibble
about valuations.  Did they not understand that the big returns
come from a few big successes, and that it therefore mattered far
more which startups you picked than how much you paid for them? After thinking about it for a while and observing certain other
signs, I have a theory that explains why the super-angels may be
smarter than they seem

Question: In the following Paul Graham passage, what does he say about 'This was not a problem'?
Answer:","This was not a problem for the startups; by definition
a high valuation means enough investors were willing to accept it"
"Context:   So maybe hacking does require some special ability to focus.
Perhaps great hackers can load a large amount of context into their
head, so that when they look at a line of code, they see not just
that line but the whole program around it.  John McPhee
wrote that Bill Bradley's success as a basketball player was due
partly to his extraordinary peripheral vision.  ""Perfect'' eyesight
means about 47 degrees of vertical peripheral vision.  Bill Bradley
had 70; he could see the basket when he was looking at the floor.
Maybe great hackers have some similar inborn ability.  (I cheat by
using a very dense language, 
which shrinks the court.) This could explain the disconnect over cubicles

Question: In the following Paul Graham passage, what does he say about '""Perfect'' eyesight means about 47'?
Answer:","""Perfect'' eyesight
means about 47 degrees of vertical peripheral vision"
"Context:  And if someone was lazy, the others would be more likely
to notice and complain. But the real advantage of the ten-man boat shows when 
you take the ten best rowers out of the big galley
and put them in a boat together.  They will have all
the extra motivation that comes from being in a small group.
But more importantly, by selecting that small a group
you can get the best rowers.  Each one will be in
the top 1%.  It's a much better deal for them to average  
their work together with a small group of their peers than to    
average it with everyone. That's the real point of startups

Question: In the following Paul Graham passage, what does he say about 'Each one will be in'?
Answer:","Each one will be in
the top 1%"
"Context:  You're committing to search for one
of the rare ideas that generates rapid growth.  Because these ideas
are so valuable, finding one is hard.  The startup is the embodiment
of your discoveries so far.  Starting a startup is thus very much
like deciding to be a research scientist: you're not committing to
solve any specific problem; you don't know for sure which problems
are soluble; but you're committing to try to discover something no
one knew before.  A startup founder is in effect an economic research
scientist.  Most don't discover anything that remarkable, but some
discover relativity

Question: In the following Paul Graham passage, what does he say about 'Starting a startup is thus'?
Answer:","Starting a startup is thus very much
like deciding to be a research scientist: you're not committing to
solve any specific problem; you don't know for sure which problems
are soluble; but you're committing to try to discover something no
one knew before"
