input,answer
"Context:  Programmers learn by doing,
and most of the things he wanted to do, he couldn't—sometimes
because the company wouldn't let him, but often because the company's
code wouldn't let him.  Between the drag of legacy code, the overhead
of doing development in such a large organization, and the restrictions
imposed by interfaces owned by other groups, he could only try a
fraction of the things he would have liked to.  He said he has
learned much more in his own startup, despite the fact that he has
to do all the company's errands as well as programming, because at
least when he's programming he can do whatever he wants. An obstacle downstream propagates upstream

Question: In the following Paul Graham passage, what does he say about 'He said he has learned'?
Answer:","He said he has
learned much more in his own startup, despite the fact that he has
to do all the company's errands as well as programming, because at
least when he's programming he can do whatever he wants"
"Context: So instead of copying the Facebook, with some variation that the
Facebook rightly ignored, look for ideas from the other direction.
Instead of starting from companies and working back to the problems
they solved, look for problems and imagine the company that might
solve them. [ 2 ] What do people complain about?  What do you wish there was? 5. Obstinacy In some fields the way to succeed is to have a vision of what you
want to achieve, and to hold true to it no matter what setbacks you
encounter.  Starting startups is not one of them.  The stick-to-your-vision
approach works for something like winning an Olympic gold medal,
where the problem is well-defined

Question: In the following Paul Graham passage, what does he say about 'The stick-to-your-vision approach works for'?
Answer:","The stick-to-your-vision
approach works for something like winning an Olympic gold medal,
where the problem is well-defined"
"Context:  If programmers
used some other device for mobile web access, they'd start to develop
apps for that instead. How could you make a device programmers liked better than the iPhone?
It's unlikely you could make something better designed.  Apple
leaves no room there.  So this alternative device probably couldn't
win on general appeal.  It would have to win by virtue of some
appeal it had to programmers specifically. One way to appeal to programmers is with software.  If you
could think of an application programmers had to have, but that
would be impossible in the circumscribed world of the iPhone, 
you could presumably get them to switch

Question: In the following Paul Graham passage, what does he say about 'How could you make a'?
Answer:","How could you make a device programmers liked better than the iPhone?
It's unlikely you could make something better designed"
"Context: What people wished they'd paid more attention to when choosing
cofounders was character and commitment, not ability.  This was
particularly true with startups that failed.  The lesson: don't
pick cofounders who will flake. Here's a typical reponse: You haven't seen someone's true colors unless you've worked
    with them on a startup. The reason character is so important is that it's tested more
severely than in most other situations.  One founder said explicitly
that the relationship between founders was more important than
ability: I would rather cofound a startup with a friend than a stranger
    with higher output

Question: In the following Paul Graham passage, what does he say about 'One founder said explicitly that'?
Answer:","One founder said explicitly
that the relationship between founders was more important than
ability: I would rather cofound a startup with a friend than a stranger
    with higher output"
"Context:  C was written by people who needed it for systems programming.
Lisp was developed partly to do symbolic differentiation, and
McCarthy was so eager to get started that he was writing differentiation
programs even in the first paper on Lisp, in 1960. It's especially good if your application solves some new problem.
That will tend to drive your language to have new features that   
programmers need.  I personally am interested in writing
a language that will be good for writing server-based applications

Question: In the following Paul Graham passage, what does he say about 'That will tend to drive'?
Answer:","That will tend to drive your language to have new features that   
programmers need"
"Context: The other big change is that now, you're steering.  You can go
anywhere you want. So it may be worth standing back and understanding
what's going on, instead of just doing the default thing. All through college, and probably long before that, most undergrads 
have been thinking about what employers want.  But what really 
matters is what customers want, because they're the ones who give
employers the money to pay you. So instead of thinking about what employers want, you're probably
better off thinking directly about what users want.  To the extent 
there's any difference between the two, you can even use that to
your advantage if you start a company of your own

Question: In the following Paul Graham passage, what does he say about 'So instead of thinking about'?
Answer:","So instead of thinking about what employers want, you're probably
better off thinking directly about what users want"
"Context:  But even then we barely made
it.  The first dinner in California, we had to warn all the founders
not to touch the walls, because the paint was still wet.

We modelled YC on the seed funding we ourselves had taken
when we started Viaweb.  We started Viaweb with $10k we got from
our friend Julian Weber ,
the husband of Idelle Weber, whose
painting class I took as a grad student at Harvard.  Julian knew
about business, but you would not describe him as a suit.  Among
other things he'd been president of the National Lampoon .  He was
also a lawyer, and got all our paperwork set up properly

Question: In the following Paul Graham passage, what does he say about 'We started Viaweb with $10k'?
Answer:","We started Viaweb with $10k we got from
our friend Julian Weber ,
the husband of Idelle Weber, whose
painting class I took as a grad student at Harvard"
"Context:  The problem is, for the company to exist, you have to
decide who the founders are, and how much stock they each have.  If
there are two founders with the same qualifications who are both
equally committed to the business, that's easy.  But if you have a
number of people who are expected to contribute in varying degrees,
arranging the proportions of stock can be hard.  And once you've
done it, it tends to be set in stone. I have no tricks for dealing with this problem.  All I can say is,
try hard to do it right.  I do have a rule of thumb for recognizing
when you have, though

Question: In the following Paul Graham passage, what does he say about 'All I can say is,'?
Answer:","All I can say is,
try hard to do it right"
"Context: It's just a legitimate
sounding way of saying: we don't like your type around here. But the best thing of all is when people call what you're doing
inappropriate.  I've been hearing this word all my life and I only
recently realized that it is, in fact, the sound of the homing
beacon.  ""Inappropriate"" is the null criticism.  It's merely the
adjective form of ""I don't like it."" So that, I think, should be the highest goal for the marginal.  Be
inappropriate.  When you hear people saying that, you're golden.
And they, incidentally, are busted. Notes [ 1 ]
The facts about Apple's early history are from an interview 
with Steve 
Wozniak in Jessica Livingston's Founders at Work 

Question: In the following Paul Graham passage, what does he say about 'I've been hearing this word'?
Answer:","I've been hearing this word all my life and I only
recently realized that it is, in fact, the sound of the homing
beacon"
"Context:  At home, hackers can arrange things themselves
so they can get the most done.  And when they work at home, hackers
don't work in noisy, open spaces; they work in rooms with doors.  They
work in cosy, neighborhoody places with people around and somewhere
to walk when they need to mull something over, instead of in glass
boxes set in acres of parking lots.  They have a sofa they can take
a nap on when they feel tired, instead of sitting in a coma at
their desk, pretending to work.  There's no crew of people with
vacuum cleaners that roars through every evening during the prime
hacking hours.  There are no meetings or, God forbid, corporate
retreats or team-building exercises

Question: In the following Paul Graham passage, what does he say about 'And when they work at'?
Answer:","And when they work at home, hackers
don't work in noisy, open spaces; they work in rooms with doors"
"Context:  But the real problem for Microsoft
wasn't the embarrassment of the people they hired.  It was the
people they never got.  And you know who got them?  Google and
Apple.  If Microsoft was the Empire, they were the Rebel Alliance.
And it's largely because they got more of the best people that
Google and Apple are doing so much better than Microsoft today. Why are programmers so fussy about their employers' morals?  Partly
because they can afford to be.  The best programmers can work
wherever they want.  They don't have to work for a company they
have qualms about. But the other reason programmers are fussy, I think, is that evil
begets stupidity

Question: In the following Paul Graham passage, what does he say about 'It was the people they'?
Answer:","It was the
people they never got"
"Context:  As a kid there's a magic button you can press by saying
""I'm just a kid"" that will get you out of most difficult situations.
Whereas adults, by definition, are not allowed to flake.  They still
do, of course, but when they do they're ruthlessly pruned. The other way to tell an adult is by how they react to a challenge.
Someone who's not yet an adult will tend to respond to a challenge
from an adult in a way that acknowledges their dominance.  If an
adult says ""that's a stupid idea,"" a kid will either crawl away
with his tail between his legs, or rebel.  But rebelling presumes
inferiority as much as submission

Question: In the following Paul Graham passage, what does he say about 'If an adult says ""that's'?
Answer:","If an
adult says ""that's a stupid idea,"" a kid will either crawl away
with his tail between his legs, or rebel"
"Context: The reason convertible notes allow more flexibility in price is
that valuation caps aren't actual valuations, and notes are cheap
and easy to do.  So you can do high-resolution fundraising: if you
wanted you could have a separate note with a different cap for each
investor. That cap need not simply rise monotonically.  A startup could 
also give better deals to investors they expected to help
them most.  The point is simply that different investors, 
whether because of the help they offer or their willingness to
commit, have different values for
startups, and their terms should reflect that. Different terms for different investors is
clearly the way of the future

Question: In the following Paul Graham passage, what does he say about 'A startup could also give'?
Answer:","A startup could 
also give better deals to investors they expected to help
them most"
"Context:  My only leisure activities were
running, which I needed to do to keep working anyway, and about
fifteen minutes of reading a night.  I had a girlfriend for a total
of two months during that three year period.  Every couple weeks I
would take a few hours off to visit a used bookshop or go to a  
friend's house for dinner.  I went to visit my family twice.
Otherwise I just worked. Working was often fun, because the people I worked with were some
of my best friends.  Sometimes it was even technically interesting.
But only about 10% of the time

Question: In the following Paul Graham passage, what does he say about 'My only leisure activities were'?
Answer:","My only leisure activities were
running, which I needed to do to keep working anyway, and about
fifteen minutes of reading a night"
"Context: Cook another 2 or
3 minutes, then add beans (don't drain the beans), and stir. Throw
in the bouillon cube(s), cover, and cook on lowish heat for at least
10 minutes more. Stir vigilantly to avoid sticking. If you want to save money, buy beans in giant cans from discount
stores.  Spices are also much cheaper when bought in bulk.
If there's an Indian grocery store near you, they'll have big 
bags of cumin for the same price as the little jars in supermarkets. [ 2 ]
There's a good chance that a shift in power from investors
to founders would actually increase the size of the venture business.
I think investors currently err too far on the side of being harsh
to founders

Question: In the following Paul Graham passage, what does he say about 'Spices are also much cheaper'?
Answer:",Spices are also much cheaper when bought in bulk
"Context:  On the web, articles
you have to pay for might as well not exist.  Even if you were    
willing to pay to read them yourself, you can't link to them.    
They're not part of the conversation. Another place democracy seems to win is in deciding what counts as
news.  I never look at any news site now except Reddit . [ 2 ] I know if something major
happens, or someone writes a particularly interesting article, it   
will show up there.  Why bother checking the front page of any
specific paper or magazine?  Reddit's like an RSS feed for the whole
web, with a filter for quality

Question: In the following Paul Graham passage, what does he say about 'Even if you were willing'?
Answer:","Even if you were    
willing to pay to read them yourself, you can't link to them"
"Context:  Once you've  
acquired a large substrate of utilities, writing a new program can
take only a fraction of the effort it would require if you had to 
start with raw Lisp. Bottom-up design makes programs easier to read. An instance of this type
of abstraction asks the reader to understand a general-purpose operator;
an instance of functional abstraction asks the reader to understand
a special-purpose subroutine. [1] Because it causes you always to be on the lookout for patterns
in your code, working bottom-up helps to clarify your ideas about
the design of your program

Question: In the following Paul Graham passage, what does he say about 'Once you've acquired a large'?
Answer:","Once you've  
acquired a large substrate of utilities, writing a new program can
take only a fraction of the effort it would require if you had to 
start with raw Lisp"
"Context:  They've invested in dozens of startups,
whereas this is probably the first you've founded.  But don't let
them or the situation intimidate you. The average founder is smarter
than the average VC.  So just do what you'd do in any complex,
unfamiliar situation: proceed deliberately, and question anything
that seems odd. It is, unfortunately, common for VCs to put terms in an agreement
whose consequences surprise founders later, and also common for VCs
to defend things they do by saying that they're standard in the
industry.  Standard, schmandard; the whole industry is only a few
decades old, and rapidly evolving

Question: In the following Paul Graham passage, what does he say about 'But don't let them or'?
Answer:","But don't let
them or the situation intimidate you"
"Context:  If you want to make your
user numbers go up, put a big piece of paper on your wall and every
day plot the number of users.  You'll be delighted when it goes up
and disappointed when it goes down.  Pretty soon you'll start
noticing what makes the number go up, and you'll start to do more
of that.  Corollary: be careful what you measure. 8. Spend little. I can't emphasize enough how important it is for a startup to be cheap.
Most startups fail before they make something people want, and the
most common form of failure is running out of money.  So being cheap
is (almost) interchangeable with iterating rapidly. [ 4 ] But it's
more than that

Question: In the following Paul Graham passage, what does he say about 'If you want to make'?
Answer:","If you want to make your
user numbers go up, put a big piece of paper on your wall and every
day plot the number of users"
"Context:  Markets always evolve toward higher
resolution.  You may not need to use convertible notes to do it.
With sufficiently lightweight standardized equity terms (and some
changes in investors' and lawyers' expectations about equity rounds)
you might be able to do the same thing with equity instead of debt.
Either would be fine with startups, so long as they can easily
change their valuation. Deadlocks weren't the only problem with fixed-size equity rounds.
Another was that startups had to decide in advance how much to
raise.  I think it's a mistake for a startup to fix upon a specific
number

Question: In the following Paul Graham passage, what does he say about 'With sufficiently lightweight standardized equity'?
Answer:","With sufficiently lightweight standardized equity terms (and some
changes in investors' and lawyers' expectations about equity rounds)
you might be able to do the same thing with equity instead of debt"
"Context:  We
didn't know ourselves which VC firms were the impressive ones.  We
thought software was all that mattered.  But that turned out to be
the right direction to be naive in: it's much better to overestimate
than underestimate the importance of making a good product. [ 6 ]
I've omitted one source: government grants

Question: In the following Paul Graham passage, what does he say about 'But that turned out to'?
Answer:","But that turned out to be
the right direction to be naive in: it's much better to overestimate
than underestimate the importance of making a good product"
"Context:  The professors will get whoever they
admit as their own grad students, so they try hard to choose well,
and they have a fair amount of data to go on.  Whereas undergraduate
admissions seem to be much more hackable. One way to tell whether a field has consistent standards is the
overlap between the leading practitioners and the people who teach
the subject in universities.  At one end of the scale you have
fields like math and physics, where nearly all the teachers are
among the best practitioners.  In the middle are medicine, law,
history, architecture, and computer science, where many are

Question: In the following Paul Graham passage, what does he say about 'In the middle are medicine,'?
Answer:","In the middle are medicine, law,
history, architecture, and computer science, where many are"
"Context:  The people are the most important ingredient
in a startup, so don't compromise there. 18. A Half-Hearted Effort The failed startups you hear most about are the spectacular
flameouts.  Those are actually the elite of failures.  The most
common type is not the one that makes spectacular mistakes, but the
one that doesn't do much of anything — the one we never even hear
about, because it was some project a couple guys started on the
side while working on their day jobs, but which never got anywhere
and was gradually abandoned. Statistically, if you want to avoid failure, it would seem like the
most important thing is to quit your day job

Question: In the following Paul Graham passage, what does he say about 'Those are actually the elite'?
Answer:",Those are actually the elite of failures
"Context: But if VCs ask, just point out that they
wouldn't want you telling other firms about your conversations, and
you feel obliged to do the same for any firm you talk to.  If they
push you, point out that you're inexperienced at fundraising — which
is always a safe card to play — and you feel you have to be
extra cautious. [ 3 ] While few startups will experience a stampede of interest, almost
all will at least initially experience the other side of this
phenomenon, where the herd remains clumped together at a distance.
The fact that investors are so much influenced by other investors'
opinions means you always start out in something of a hole

Question: In the following Paul Graham passage, what does he say about 'The fact that investors are'?
Answer:","The fact that investors are so much influenced by other investors'
opinions means you always start out in something of a hole"
"Context:  Humans
also seem designed to work in groups, and what I've read about
hunter-gatherers accords with research on organizations and my own
experience to suggest roughly what the ideal size is: groups of 8
work well; by 20 they're getting hard to manage; and a group of 50
is really unwieldy. [ 1 ] Whatever the upper limit is, we are clearly not meant to work in
groups of several hundred.  And yet—for reasons having more
to do with technology than human nature—a great many people
work for companies with hundreds or thousands of employees. Companies know groups that large wouldn't work, so they divide
themselves into units small enough to work together

Question: In the following Paul Graham passage, what does he say about 'And yet—for reasons having more'?
Answer:","And yet—for reasons having more
to do with technology than human nature—a great many people
work for companies with hundreds or thousands of employees"
"Context:  At one extreme is the sort of pork-barrel project where
a town gets money from the state government to renovate a vacant
building as a ""high-tech incubator,"" as if it were merely lack of
the right sort of office space that had till now prevented the town
from becoming a startup hub .  
At the other extreme are places like
Idealab, which generates ideas for new startups internally and hires
people to work for them. The classic Bubble incubators, most of which now seem to be dead,
were like VC firms except that they took a much bigger role in the
startups they funded.  In addition to working in their space, you
were supposed to use their office staff, lawyers, accountants, and
so on

Question: In the following Paul Graham passage, what does he say about 'At one extreme is the'?
Answer:","At one extreme is the sort of pork-barrel project where
a town gets money from the state government to renovate a vacant
building as a ""high-tech incubator,"" as if it were merely lack of
the right sort of office space that had till now prevented the town
from becoming a startup hub"
"Context:  If the company does badly, he's done badly. A company that could pay all its employees so straightforwardly   
would be enormously successful.  Many employees would work harder
if they could get paid for it.  More importantly,
such a company would attract people who wanted to work
especially hard. 
It would crush its competitors. Unfortunately, companies can't pay everyone like salesmen.  Salesmen
work alone.  Most employees' work is tangled together.  Suppose
a company makes some kind of consumer gadget

Question: In the following Paul Graham passage, what does he say about 'More importantly, such a company'?
Answer:","More importantly,
such a company would attract people who wanted to work
especially hard"
"Context:   All the super-angels know
is that their new model seems promising enough to be worth trying,
and all the VCs know is that it seems promising enough to worry
about. Rounds Whatever the outcome, the conflict between VCs and super-angels is
good news for founders.  And not just for the obvious reason that
more competition for deals means better terms.  The whole shape of
deals is changing. One of the biggest differences between angels and VCs is the amount
of your company they want.  VCs want a lot.  In a series A round
they want a third of your company, if they can get it

Question: In the following Paul Graham passage, what does he say about 'And not just for the'?
Answer:","And not just for the obvious reason that
more competition for deals means better terms"
"Context:  One of the reasons was that, to save
money, he'd designed the Apple II to use a TV as a monitor, and HP
felt they couldn't produce anything so declasse. Less Wozniak used a TV as a monitor for the simple reason that he couldn't
afford a monitor.  Outsiders are not merely free but compelled to
make things that are cheap and lightweight.  And both are good bets
for growth: cheap things spread faster, and lightweight things
evolve faster. The eminent, on the other hand, are almost forced to work on a large
scale

Question: In the following Paul Graham passage, what does he say about 'Outsiders are not merely free'?
Answer:","Outsiders are not merely free but compelled to
make things that are cheap and lightweight"
"Context:  Before you launch, you're like a
police artist before he's shown the first version of his sketch to
the witness. It's so important to launch fast that it may be better to think of
your initial version not as a product, but as a trick for getting
users to start talking to you. I learned to think about the initial stages of a startup as a
    giant experiment. All products should be considered experiments,
    and those that have a market show promising results extremely
    quickly. Once you start talking to users, I guarantee you'll be surprised
by what they tell you

Question: In the following Paul Graham passage, what does he say about 'Before you launch, you're like'?
Answer:","Before you launch, you're like a
police artist before he's shown the first version of his sketch to
the witness"
