input,answer
"Context:  Growth is why startups usually
work on technology — because ideas for fast growing companies are
so rare that the best way to find new ones is to discover those
recently made viable by change, and technology is the best source
of rapid change.  Growth is why it's a rational choice economically
for so many founders to try starting a startup: growth makes the
successful companies so valuable that the expected value is high
even though the risk is too.  Growth is why VCs want to invest in
startups: not just because the returns are high but also because
generating returns from capital gains is easier to manage than
generating returns from dividends

Question: In the following Paul Graham passage, what does he say about 'Growth is why it's a'?
Answer:","Growth is why it's a rational choice economically
for so many founders to try starting a startup: growth makes the
successful companies so valuable that the expected value is high
even though the risk is too"
"Context:  Suppose you approached investors with the following
idea for a Web 2.0 startup: Sites like del.icio.us and flickr allow users to ""tag"" content
  with descriptive tokens.  But there is also huge source of implicit tags that they ignore: the text within web links.
  Moreover, these links represent a social network connecting the   
  individuals and organizations who created the pages, and by using
  graph theory we can compute from this network an estimate of the
  reputation of each member.  We plan to mine the web for these 
  implicit tags, and use them together with the reputation hierarchy
  they embody to enhance web searches

Question: In the following Paul Graham passage, what does he say about 'us and flickr allow users'?
Answer:","us and flickr allow users to ""tag"" content
  with descriptive tokens"
"Context:   It's not something like physics or medicine
that requires extensive study.  You just try to get people to pay
you for stuff. I think the reason I made such a mystery of business was that I was
disgusted by the idea of doing it.  I wanted to work in the pure,   
intellectual world of software, not deal with customers' mundane  
problems.  People who don't want to get dragged into some kind of
work often develop a protective incompetence at it.  Paul Erdos was
particularly good at this.  By seeming unable even to cut a grapefruit
in half (let alone go to the store and buy one), he forced other
people to do such things for him, leaving all his time free for
math

Question: In the following Paul Graham passage, what does he say about 'It's not something like physics'?
Answer:","It's not something like physics or medicine
that requires extensive study"
"Context:  So
don't be demoralized by how hard it is to get the first commitment,
because much of the difficulty comes from this external force.  The
second will be easier. Notes [ 1 ]
An accountant might say that a company that has raised a million
dollars is no richer if it's convertible debt, but in practice money
raised as convertible debt is little different from money raised
in an equity round. [ 2 ]
Founders are often surprised by this, but investors can get
very emotional.  Or rather indignant; that's the main emotion I've
observed; but it is very common, to the point where it sometimes
causes investors to act against their own interests

Question: In the following Paul Graham passage, what does he say about 'Notes [ 1 ] An'?
Answer:","Notes [ 1 ]
An accountant might say that a company that has raised a million
dollars is no richer if it's convertible debt, but in practice money
raised as convertible debt is little different from money raised
in an equity round"
"Context: [ 3 ]
There is one subtle danger you have to watch out for here, which
I warn about later: beware of getting too high a valuation from an
eager investor, lest that set an impossibly high target when raising
additional money. [ 4 ]
If they really need a meeting, then they're not ready to invest,
regardless of what they say. They're still deciding, which means
you're being asked to come in and convince them. Which is fundraising. [ 5 ]
Associates at VC firms regularly cold email startups.  Naive
founders think ""Wow, a VC is interested in us!""  But an associate
is not a VC.  They have no decision-making power

Question: In the following Paul Graham passage, what does he say about '[ 5 ] Associates at'?
Answer:","[ 5 ]
Associates at VC firms regularly cold email startups"
"Context:  All users
care about is whether your site or software gives them what they
want.  They don't care if the person behind it is a high school 
kid. If you're really productive, why not make employers pay market rate
for you?  Why go work as an ordinary employee for a big
company, when you could start a startup and make them buy it to get
you? When most people hear the word ""startup,"" they think of the famous 
ones that have gone public.  But most startups that succeed do it
by getting bought.  And usually the acquirer doesn't just want the
technology, but the people who created it as well. Often big companies buy startups before they're profitable.  Obviously
in such cases they're not after revenues

Question: In the following Paul Graham passage, what does he say about 'But most startups that succeed'?
Answer:","But most startups that succeed do it
by getting bought"
"Context:  But surely a necessary, if not sufficient, condition
was that people who made fortunes be able to enjoy them in peace. [ 11 ] One piece of evidence is what happened to countries
that tried to return to the old model, like the Soviet
Union, and to a lesser extent Britain under the labor
governments of the 1960s and early 1970s.  Take away the incentive
of wealth, and technical innovation grinds to a halt. Remember what a startup is, economically: 
a way of saying, I want to work faster.  Instead of accumulating
money slowly by being paid a regular wage for fifty years, I 
want to get it over with as soon as possible

Question: In the following Paul Graham passage, what does he say about 'Take away the incentive of'?
Answer:","Take away the incentive
of wealth, and technical innovation grinds to a halt"
"Context:  I think
this will become more common; the average founder is eager to do
it, and selling, say, half a million dollars worth of stock will
not, as VCs fear, cause most founders to be any less committed to
the business. The same angels who tried to screw us also let us do this, and so
on balance I'm grateful rather than angry.  (As in families, relations
between founders and investors can be complicated.) The best way to find angel investors is through personal introductions.
You could try to cold-call angel groups near you, but angels, like
VCs, will pay more attention to deals recommended by someone they
respect. Deal terms with angels vary a lot.  There are no generally accepted
standards

Question: In the following Paul Graham passage, what does he say about 'Deal terms with angels vary'?
Answer:",Deal terms with angels vary a lot
"Context: If you do have to
leave grad school, in the worst case it won't be for too long.  If
a startup fails, it will probably fail quickly enough that you can 
return to academic life.  And if it succeeds, you may find you no   
longer have such a burning desire to be an assistant professor. If you want to do it, do it.  Starting a startup is not the great
mystery it seems from outside.  It's not something you have to know
about ""business"" to do.  Build something users love, and spend less
than you make.  How hard is that? Notes [1] Google's revenues are about two billion a year, but half comes
from ads on other sites

Question: In the following Paul Graham passage, what does he say about 'If you do have to'?
Answer:","If you do have to
leave grad school, in the worst case it won't be for too long"
"Context:  You know from
an early age that you'll have some sort of job, because everyone
asks what you're going to ""be"" when you grow up. What they
don't tell you is that as a kid you're sitting on the shoulders of
someone else who's treading water, and that starting working means
you get thrown into the water on your own, and have to start treading
water yourself or sink.  ""Being"" something is incidental; the
immediate problem is not to drown. The relationship between work and money tends to dawn on you only
gradually.  At least it did for me.  One's first thought tends to
be simply ""This sucks.  I'm in debt

Question: In the following Paul Graham passage, what does he say about 'You know from an early'?
Answer:","You know from
an early age that you'll have some sort of job, because everyone
asks what you're going to ""be"" when you grow up"
"Context:  Maybe if you can arrange that we keep hearing
from you, you won't die. That may not be so naive as it sounds.  You've probably noticed
that having dinners every Tuesday with us and the other founders
causes you to get more done than you would otherwise, because every
dinner is a mini Demo Day.  Every dinner is a kind of a deadline.
So the mere constraint of staying in regular contact with us will
push you to make things happen, because otherwise you'll be embarrassed
to tell us that you haven't done anything new since the last time
we talked. If this works, it would be an amazing hack.  It would be pretty
cool if merely by staying in regular contact with us you could get
rich

Question: In the following Paul Graham passage, what does he say about 'If this works, it would'?
Answer:","If this works, it would be an amazing hack"
"Context: And the right strategy, in fundraising, is to have multiple plans
depending on how much you can raise.  Ideally you should be able
to tell investors something like: we can make it to profitability
without raising any more money, but if we raise a few hundred
thousand we can hire one or two smart friends, and if we raise a
couple million, we can hire a whole engineering team, etc. Different plans match different investors.  If you're talking to a
VC firm that only does series A rounds (though there are few of
those left), it would be a waste of time talking about any but your
most expensive plan

Question: In the following Paul Graham passage, what does he say about 'If you're talking to a'?
Answer:","If you're talking to a
VC firm that only does series A rounds (though there are few of
those left), it would be a waste of time talking about any but your
most expensive plan"
"Context: August 2006, rev. April 2007, September 2010 In a few days it will be Demo Day, when the startups we funded
this summer present to investors.  Y Combinator funds startups twice
a year, in January and June.  Ten weeks later we invite all the
investors we know to hear them present what they've built so far. Ten weeks is not much time.  The average startup probably doesn't
have much to show for itself after ten weeks.  But the average
startup fails.  When you look at the ones that went on to do great
things, you find a lot that began with someone pounding out a
prototype in a week or two of nonstop work.  Startups are a
counterexample to the rule that haste makes waste

Question: In the following Paul Graham passage, what does he say about 'The average startup probably doesn't'?
Answer:","The average startup probably doesn't
have much to show for itself after ten weeks"
"Context:  What a bang that balloon is going
to make when someone pops it by offering a free web-based alternative 
to MS Office. [ 5 ] Who will?  Google?  They seem to be taking their
time.  I suspect the pin will be wielded by a couple of 20 year old
hackers who are too naive to be intimidated by the idea.  (How hard
can it be?) The Common Thread Ajax, democracy, and not dissing users.  What do they all have in  
common?  I didn't realize they had anything in common till recently,
which is one of the reasons I disliked the term ""Web 2.0"" so much.
It seemed that it was being used as a label for whatever happened
to be new—that it didn't predict anything. But there is a common thread

Question: In the following Paul Graham passage, what does he say about 'I suspect the pin will'?
Answer:","I suspect the pin will be wielded by a couple of 20 year old
hackers who are too naive to be intimidated by the idea"
"Context:  But
there was another source even more dangerous: other Internet startups. By 1998, Yahoo was the beneficiary of a de facto Ponzi scheme.
Investors were excited about the Internet.  One reason they were
excited was Yahoo's revenue growth.  So they invested in new Internet
startups.  The startups then used the money to buy ads on Yahoo to
get traffic.  Which caused yet more revenue growth for Yahoo, and
further convinced investors the Internet was worth investing in.
When I realized this one day, sitting in my cubicle, I jumped up
like Archimedes in his bathtub, except instead of ""Eureka!"" I was
shouting ""Sell!"" Both the Internet startups and the Procter & Gambles were doing
brand advertising

Question: In the following Paul Graham passage, what does he say about 'But there was another source'?
Answer:","But
there was another source even more dangerous: other Internet startups"
"Context: Notes [ 1 ]
Strictly speaking it's impossible without a time machine. [ 2 ]
In practice it's more like a ragged comb. [ 3 ]
Joe thinks one of the founders of Hewlett Packard said it first,
but he doesn't remember which. [ 4 ]
They'd be interchangeable if markets stood still.  Since they
don't, working twice as fast is better than having twice as much
time.

Question: In the following Paul Graham passage, what does he say about '[ 2 ] In practice'?
Answer:","[ 2 ]
In practice it's more like a ragged comb"
"Context:  Being lead
developer of a popular open source project counts almost as much. That solves the problem if you get funded by Y Combinator.  What
about in the general case?  Because in another sense, it is a problem
if you don't have an idea.  If you start a startup with no idea,
what do you do next? So here's the brief recipe for getting startup ideas.  Find something
that's missing in your own life, and supply that need—no matter
how specific to you it seems.  Steve Wozniak built himself a computer;
who knew so many other people would want them?  A need that's narrow
but genuine is a better starting point than one that's broad but
hypothetical

Question: In the following Paul Graham passage, what does he say about 'Find something that's missing in'?
Answer:","Find something
that's missing in your own life, and supply that need—no matter
how specific to you it seems"
"Context:  You're doing the same thing, setting up
a separate place to hold the accumulator; it's just
a field in an object instead of the head of a list.
And the use of these special,
reserved field names, especially __call__ , seems
a bit of a hack. In the rivalry between Perl and Python, the claim of the
Python hackers seems to be that
that Python is a more elegant alternative to Perl, but what
this case shows is that power is the ultimate elegance:
the Perl program is simpler (has fewer elements), even if the
syntax is a bit uglier

Question: In the following Paul Graham passage, what does he say about 'In the rivalry between Perl'?
Answer:","In the rivalry between Perl and Python, the claim of the
Python hackers seems to be that
that Python is a more elegant alternative to Perl, but what
this case shows is that power is the ultimate elegance:
the Perl program is simpler (has fewer elements), even if the
syntax is a bit uglier"
"Context:  Sometimes angels' deal terms are as fearsome as VCs'.
Other angels, particularly in the earliest stages, will invest based
on a two-page agreement. Angels who only invest occasionally may not themselves know what
terms they want.  They just want to invest in this startup.  What
kind of anti-dilution protection do they want?  Hell if they know.
In these situations, the deal terms tend to be random: the angel
asks his lawyer to create a vanilla agreement, and the terms end
up being whatever the lawyer considers vanilla.  Which in practice
usually means, whatever existing agreement he finds lying around
his firm

Question: In the following Paul Graham passage, what does he say about 'Which in practice usually means,'?
Answer:","Which in practice
usually means, whatever existing agreement he finds lying around
his firm"
"Context: Startups Take Over Your Life Just as the relationship between cofounders is more intense than
it usually is between coworkers, so is the relationship between the
founders and the company.  Running a startup is not like having a
job or being a student, because it never stops.  This is so foreign
to most people's experience that they don't get it till it happens. [ 1 ] I didn't realize I would spend almost every waking moment either
    working or thinking about our startup.  You enter a whole
    different way of life when it's your company vs. working for
    someone else's company

Question: In the following Paul Graham passage, what does he say about '[ 1 ] I didn't'?
Answer:","[ 1 ] I didn't realize I would spend almost every waking moment either
    working or thinking about our startup"
"Context:  Now that you
can use any language, you have to think about which one to use.
Companies that try to pretend nothing has changed risk finding that
their competitors do not. If you can use any language, which do you use?  We chose Lisp.
For one thing, it was obvious that rapid development would be
important in this market.  We were all starting from scratch, so
a company that could get new features done before its competitors
would have a big advantage.  We knew Lisp was a really good language
for writing software quickly, and server-based applications magnify
the effect of rapid development, because you can release software
the minute it's done

Question: In the following Paul Graham passage, what does he say about 'Now that you can use'?
Answer:","Now that you
can use any language, you have to think about which one to use"
"Context:  One reason the young sometimes
succeed where the old fail is that they don't realize how incompetent
they are.  This lets them do a kind of deficit spending.  When they
first start working on something, they overrate their achievements.
But that gives them confidence to keep working, and their performance
improves.  Whereas someone clearer-eyed would see their initial
incompetence for what it was, and perhaps be discouraged from
continuing. There's one other major component of determination: ambition.  If
willfulness and discipline are what get you to your destination,
ambition is how you choose it

Question: In the following Paul Graham passage, what does he say about 'This lets them do a'?
Answer:",This lets them do a kind of deficit spending
"Context:  Many are annoyed that these
so-called startups get all the attention, when hardly any of them
will amount to anything. If they stepped back and looked at the whole picture they might be
less indignant.  The mistake they're making is that by basing their
opinions on anecdotal evidence they're implicitly judging by the
median rather than the average.  If you judge by the median startup,
the whole concept of a startup seems like a fraud.  You have to
invent a bubble to explain why founders want to start them or
investors want to fund them.  But it's a mistake to use the median
in a domain with so much variation

Question: In the following Paul Graham passage, what does he say about 'Many are annoyed that these'?
Answer:","Many are annoyed that these
so-called startups get all the attention, when hardly any of them
will amount to anything"
"Context:  Even if you start the way most successful startups
have, by building something you yourself need, the first thing you
build is never quite right.  And except in domains with big penalties
for making mistakes, it's often better not to aim for perfection
initially.  In software, especially, it usually works best to get
something in front of users as soon as it has a quantum of utility,
and then see what they do with it.  Perfectionism is often an excuse
for procrastination, and in any case your initial model of users
is always inaccurate, even if you're one of them. [ 7 ] The feedback you get from engaging directly with your earliest users
will be the best you ever get

Question: In the following Paul Graham passage, what does he say about 'And except in domains with'?
Answer:","And except in domains with big penalties
for making mistakes, it's often better not to aim for perfection
initially"
"Context:  I think people believe that coming
up with ideas for startups is very hard-- that it must be
very hard-- and so they don't try do to it.  They assume ideas are
like miracles: they either pop into your head or they don't. I also have a theory about why people think this.  They overvalue
ideas.  They think creating a startup is just a matter of implementing
some fabulous initial idea.  And since a successful startup is worth
millions of dollars, a good idea is therefore a million dollar idea. If coming up with an idea for a startup equals coming up with a
million dollar idea, then of course it's going to seem hard.  Too
hard to bother trying

Question: In the following Paul Graham passage, what does he say about 'And since a successful startup'?
Answer:","And since a successful startup is worth
millions of dollars, a good idea is therefore a million dollar idea"
"Context:  The pipes are narrow and twisty, and there are leaks
in every joint.  In the future this mess will gradually be replaced
by a single, huge pipe.  The water will still have to get from A
to B, but it will get there faster and without the risk of spraying
out through some random leak. This will change a lot of things for the better.  In a big, straight
pipe like that, the force of being measured by one's performance
will propagate back through the whole system.  Performance is always
the ultimate test, but there are so many kinks in the plumbing now
that most people are insulated from it most of the time

Question: In the following Paul Graham passage, what does he say about 'The water will still have'?
Answer:","The water will still have to get from A
to B, but it will get there faster and without the risk of spraying
out through some random leak"
"Context: May 2004 (This essay was originally published in Hackers 
& Painters .) If you wanted to get rich, how would you do it? I think your best
bet would be to start or join a startup.  That's been a 
reliable way to get rich for hundreds of years.  The word ""startup"" 
dates from the 1960s, but what happens in one is 
very similar to the venture-backed trading voyages of the
Middle Ages. Startups usually involve technology, so much so that the phrase
""high-tech startup"" is almost redundant.  A startup is a small
company that takes on a hard technical problem. Lots of people get rich knowing nothing more than that.
You don't have to know physics to be a good pitcher

Question: In the following Paul Graham passage, what does he say about 'May 2004 (This essay was'?
Answer:","May 2004 (This essay was originally published in Hackers 
& Painters"
"Context: This section is now obsolete for YC founders presenting
at Demo Day, because Demo Day presentations are now so short
that they rarely include much if any demo.  They seem to work
just as well without, however, which makes me think I was
wrong to emphasize demos so much before. A demo explains what you've made more effectively than any verbal
description.  The only thing worth talking about first is the problem
you're trying to solve and why it's important.  But don't spend
more than a tenth of your time on that.  Then demo. When you demo, don't run through a catalog of features.  Instead
start with the problem you're solving, and then show how your product
solves it

Question: In the following Paul Graham passage, what does he say about 'A demo explains what you've'?
Answer:","A demo explains what you've made more effectively than any verbal
description"
"Context:  If you're not allowed
to implement new ideas, you stop having them.  And vice versa: when
you can do whatever you want, you have more ideas about what to do.
So working for yourself makes your brain more powerful in the same
way a low-restriction exhaust system makes an engine more powerful. Working for yourself doesn't have to mean starting a startup, of
course.  But a programmer deciding between a regular job at a big
company and their own startup is probably going to learn more doing
the startup. You can adjust the amount of freedom you get by scaling the size
of company you work for.  If you start the company, you'll have the
most freedom

Question: In the following Paul Graham passage, what does he say about 'You can adjust the amount'?
Answer:","You can adjust the amount of freedom you get by scaling the size
of company you work for"
"Context:  That was our favorite part of the Bay Area.
But we didn't have time to get a building in Berkeley.  We didn't
have time to get our own building anywhere. The only way to get
enough space in time was to convince Trevor to let us take over
part of his (as it then seemed) giant building in Mountain View.
Yet again we lucked out, because Mountain View turned out to be the
ideal place to put something like YC.  But even then we barely made
it.  The first dinner in California, we had to warn all the founders
not to touch the walls, because the paint was still wet.

Initially we only had part of the idea. We were going to do
seed funding with standardized terms.  Before YC, seed funding was
very haphazard

Question: In the following Paul Graham passage, what does he say about 'Initially we only had part'?
Answer:",Initially we only had part of the idea
