input,answer
"Context: March 2007 (This essay is derived from talks at the 2007 
Startup School and the Berkeley CSUA.) We've now been doing Y Combinator long enough to have some data
about success rates.  Our first batch, in the summer of 2005, had
eight startups in it.  Of those eight, it now looks as if at least
four succeeded.  Three have been acquired: Reddit was a merger of
two, Reddit and Infogami, and a third was acquired that we can't
talk about yet.  Another from that batch was Loopt , which is doing
so well they could probably be acquired in about ten minutes if
they wanted to. So about half the founders from that first summer, less than two
years ago, are now rich, at least by their standards

Question: In the following Paul Graham passage, what does he say about ') We've now been doing'?
Answer:",") We've now been doing Y Combinator long enough to have some data
about success rates"
"Context:  Nearly every startup
that fails, fails by running out of money.  It's a little misleading
to put it this way, because there's usually some other underlying
cause.  But regardless of the source of your problems, a low burn
rate gives you more opportunity to recover from them.  And since
most startups make all kinds of mistakes at first, room to recover
from mistakes is a valuable thing to have. Most startups end up doing something different than they planned.
The way the successful ones find something that works is by trying
things that don't.  So the worst thing you can do in a startup is
to have a rigid, pre-ordained plan and then start spending a lot
of money to implement it

Question: In the following Paul Graham passage, what does he say about 'The way the successful ones'?
Answer:","The way the successful ones find something that works is by trying
things that don't"
"Context: In the future, angel rounds will less often be for specific amounts
or have a lead investor.  In the old days, the standard m.o. for
startups was to find one angel to act as the lead investor.  You'd
negotiate a round size and valuation with the lead, who'd supply
some but not all of the money.  Then the startup and the lead would
cooperate to find the rest. The future of angel rounds looks more like this: instead of a fixed
round size, startups will do a rolling close, where they take money
from investors one at a time till they feel they have enough

Question: In the following Paul Graham passage, what does he say about 'Then the startup and the'?
Answer:","Then the startup and the lead would
cooperate to find the rest"
"Context:  In the first batch of startups we funded, in the summer
of 2005, most of the founders spent all their time building their
applications.  But there was one who was away half the time talking
to executives at cell phone companies, trying to arrange deals.
Can you imagine anything more painful for a hacker? [ 10 ] But it
paid off, because this startup seems the most successful of that
group by an order of magnitude. If you want to start a startup, you have to face the fact that you
can't just hack.  At least one hacker will have to spend some of
the time doing business stuff. 17. Fights Between Founders Fights between founders are surprisingly common

Question: In the following Paul Graham passage, what does he say about 'In the first batch of'?
Answer:","In the first batch of startups we funded, in the summer
of 2005, most of the founders spent all their time building their
applications"
"Context:  But of course what makes investing so counterintuitive is
that in equity markets, good times are defined as everyone thinking
it's time to buy.  You have to be a contrarian to be correct, and
by definition only a minority of investors can be. So just as investors in 1999 were tripping over one another trying
to buy into lousy startups, investors in 2009 will presumably be
reluctant to invest even in good ones. You'll have to adapt to this.  But that's nothing new: startups
always have to adapt to the whims of investors.  Ask any founder
in any economy if they'd describe investors as fickle, and watch
the face they make.  Last year you had to be prepared to explain
how your startup was viral

Question: In the following Paul Graham passage, what does he say about 'But that's nothing new: startups'?
Answer:","But that's nothing new: startups
always have to adapt to the whims of investors"
"Context: If you think about famous startups, it's pretty clear how big a
role luck plays.  Where would Microsoft be if IBM insisted on an
exclusive license for DOS? Why are founders fooled by this?  Business guys probably aren't,
but hackers are used to a world where skill is paramount, and you
get what you deserve. When we started our startup, I had bought the hype of the startup
    founder dream: that this is a game of skill. It is, in some
    ways.  Having skill is valuable. So is being determined as all
    hell. But being lucky is the critical ingredient. Actually the best model would be to say that the outcome is the product of skill, determination, and luck

Question: In the following Paul Graham passage, what does he say about 'So is being determined as'?
Answer:","So is being determined as all
    hell"
"Context: The combined code can be much shorter than if you
had written your whole program in the base language-- indeed,
this is how most compression algorithms work.
A bottom-up program should be easier to modify as well,  
because in many cases the language layer won't have to change
at all

Question: In the following Paul Graham passage, what does he say about 'The combined code can be'?
Answer:","The combined code can be much shorter than if you
had written your whole program in the base language-- indeed,
this is how most compression algorithms work"
"Context:  It
seems safe to say there are more undergrads who want to be novelists
and whose parents want them to be doctors than who want to be doctors
and whose parents want them to be novelists.  The kids think their
parents are ""materialistic."" Not necessarily.  All parents tend to
be more conservative for their kids than they would for themselves,
simply because, as parents, they share risks more than rewards.  If
your eight year old son decides to climb a tall tree, or your teenage
daughter decides to date the local bad boy, you won't get a share
in the excitement, but if your son falls, or your daughter gets
pregnant, you'll have to deal with the consequences

Question: In the following Paul Graham passage, what does he say about 'If your eight year old'?
Answer:","If
your eight year old son decides to climb a tall tree, or your teenage
daughter decides to date the local bad boy, you won't get a share
in the excitement, but if your son falls, or your daughter gets
pregnant, you'll have to deal with the consequences"
"Context: That's
why there are a lot of ski instructors and not many running
instructors. [ 1 ] You can, however, trust your instincts about people.  And in fact
one of the most common mistakes young founders make is not to
do that enough.  They get involved with people who seem impressive,
but about whom they feel some misgivings personally.  Later when
things blow up they say ""I knew there was something off about him,
but I ignored it because he seemed so impressive."" If you're thinking about getting involved with someone — as a
cofounder, an employee, an investor, or an acquirer — and you
have misgivings about them, trust your gut.  If someone seems
slippery, or bogus, or a jerk, don't ignore it

Question: In the following Paul Graham passage, what does he say about 'Later when things blow up'?
Answer:","Later when
things blow up they say ""I knew there was something off about him,
but I ignored it because he seemed so impressive"
"Context: In an essay I wrote a couple years ago 
I advised graduating seniors
to work for a couple years for another company before starting their
own.  I'd modify that now.  Work for another company if you want
to, but only for a small one, and if you want to start your own
startup, go ahead. The reason I suggested college graduates not start startups immediately
was that I felt most would fail.  And they will.  But ambitious
programmers are better off doing their own thing and failing than
going to work at a big company.  Certainly they'll learn more.  They
might even be better off financially

Question: In the following Paul Graham passage, what does he say about 'In an essay I wrote'?
Answer:","In an essay I wrote a couple years ago 
I advised graduating seniors
to work for a couple years for another company before starting their
own"
"Context: In fact, I don't think there's any limit to the number of startups
that could succeed.  Startups succeed by creating wealth, which is
the satisfaction of people's desires.  And people's desires seem
to be effectively infinite, at least in the short term. What the increasing number of startups does mean is that you won't
be able to sit on a good idea.  Other people have your idea, and
they'll be increasingly likely to do something about it. 10. Faster Advances There's a good side to that, at least for consumers of
technology.  If people get right to work implementing ideas instead
of sitting on them, technology will evolve faster

Question: In the following Paul Graham passage, what does he say about 'If people get right to'?
Answer:","If people get right to work implementing ideas instead
of sitting on them, technology will evolve faster"
"Context: I suspect VCs accept business plans ""over the transom"" more as a
way to keep tabs on industry trends than as a source of deals.  In
fact, I would strongly advise against mailing your business plan
randomly to VCs, because they treat this as evidence of laziness.
Do the extra work of getting personal introductions.  As one VC put
it: I'm not hard to find.  I know a lot of people.  If you can't find
  some way to reach me, how are you going to create a successful
  company? One of the most difficult problems for startup founders is deciding
when to approach VCs. You really only get one chance, because they
rely heavily on first impressions

Question: In the following Paul Graham passage, what does he say about 'I suspect VCs accept business'?
Answer:","I suspect VCs accept business plans ""over the transom"" more as a
way to keep tabs on industry trends than as a source of deals"
"Context:  ""Business plan"" has that word ""business"" in
it, so I figured it had to be something I'd have to read a book
about business plans to write.  Well, it doesn't.  At this stage,
all most investors expect is a brief description of what you plan    
to do and how you're going to make money from it, and the resumes 
of the founders.  If you just sit down and write out what you've
been saying to one another, that should be fine.  It shouldn't take
more than a couple hours, and you'll probably find that writing it
all down gives you more ideas about what to do. For the angel to have someone to make the check out to, you're going
to have to have some kind of company.  Merely incorporating yourselves
isn't hard

Question: In the following Paul Graham passage, what does he say about 'For the angel to have'?
Answer:","For the angel to have someone to make the check out to, you're going
to have to have some kind of company"
"Context: We modelled YC on the seed funding we ourselves had taken
when we started Viaweb.  We started Viaweb with $10k we got from
our friend Julian Weber ,
the husband of Idelle Weber, whose
painting class I took as a grad student at Harvard.  Julian knew
about business, but you would not describe him as a suit.  Among
other things he'd been president of the National Lampoon .  He was
also a lawyer, and got all our paperwork set up properly.  In return
for $10k, getting us set up as a company, teaching us what
business was about, and remaining calm in times of crisis, Julian
got 10% of Viaweb.  I remember thinking once what a good deal
Julian got

Question: In the following Paul Graham passage, what does he say about 'Among other things he'd been'?
Answer:","Among
other things he'd been president of the National Lampoon"
"Context:  For the price of a Linux box, a
copy of K&R, and a few hours of advice from your neighbor's fifteen
year old son, you'll be well on your way. [4] Corollary: Avoid starting a startup to sell things to the biggest
company of all, the government.  Yes, there are lots of opportunities
to sell them technology.  But let someone else start those startups. [5] A friend who started a company in Germany told me they do care 
about the paperwork there, and that there's more of it.  Which helps
explain why there are not more startups in Germany. [6] At the seed stage our valuation was in principle $100,000, because
Julian got 10% of the company

Question: In the following Paul Graham passage, what does he say about 'Yes, there are lots of'?
Answer:","Yes, there are lots of opportunities
to sell them technology"
"Context:  But I think there's more going on than this.  There
are real disadvantages to being an insider, and in some kinds of
work they can outweigh the advantages. Imagine, for example, what would happen if the government decided
to commission someone to write an official Great American Novel.
First there'd be a huge ideological squabble over who to choose.
Most of the best writers would be excluded for having offended one
side or the other

Question: In the following Paul Graham passage, what does he say about 'Imagine, for example, what would'?
Answer:","Imagine, for example, what would happen if the government decided
to commission someone to write an official Great American Novel"
"Context: One way to mitigate this problem might be to actively plan your
startup while you're getting those n years of experience.  Sure,
go off and get jobs or go to grad school or whatever, but get
together regularly to scheme, so the idea of starting a startup
stays alive in everyone's brain.  I don't know if this works, but
it can't hurt to try. It would be helpful just to realize what an advantage you have as
students.  Some of your classmates are probably going to be successful
startup founders; at a great technical university, that is a near
certainty.  So which ones?  If I were you I'd look for the people
who are not just smart, but incurable builders 

Question: In the following Paul Graham passage, what does he say about 'So which ones? If I'?
Answer:","So which ones?  If I were you I'd look for the people
who are not just smart, but incurable builders"
"Context:  If a salesman wants to work harder,
he can just start doing it, and he will automatically
get paid proportionally more. There is one other job besides sales where big companies can
hire first-rate people: in the top management jobs. 
And for the same reason: their performance can
be measured.  The top managers are
held responsible for the performance of the entire company.
Because an ordinary employee's performance can't usually
be measured, he is not expected to do
more than put in a solid effort.  Whereas top management, like
salespeople, have to actually come up with the numbers.
The CEO of a company that tanks cannot plead that he put in  
a solid effort

Question: In the following Paul Graham passage, what does he say about 'If a salesman wants to'?
Answer:","If a salesman wants to work harder,
he can just start doing it, and he will automatically
get paid proportionally more"
"Context: September 2009 Like all investors, we spend a lot of time trying to learn how to
predict which startups will succeed.  We probably spend more time
thinking about it than most, because we invest the earliest.
Prediction is usually all we have to rely on. We learned quickly that the most important predictor of success is
determination.  At first we thought it might be intelligence.
Everyone likes to believe that's what makes startups succeed.  It
makes a better story that a company won because its founders were
so smart.  The PR people and reporters who spread such stories
probably believe them themselves.  But while it certainly helps to
be smart, it's not the deciding factor

Question: In the following Paul Graham passage, what does he say about 'Everyone likes to believe that's'?
Answer:",Everyone likes to believe that's what makes startups succeed
"Context:  When people came to YC to speak
at the dinners that first summer, they came in the spirit of someone
coming to address a Boy Scout troop.  By the time they left the
building they were all saying some variant of ""Wow, these
companies might actually succeed."" Now YC is well enough known that people are no longer surprised
when the companies we fund are legit, but it took a
while for reputation to catch up with reality.  That's one of the
reasons we especially like funding ideas that might be dismissed
as ""toys""  because YC itself was dismissed as one initially. When we saw how well it worked to fund companies synchronously,
we decided we'd keep doing that.  We'd fund two batches of
startups a year

Question: In the following Paul Graham passage, what does he say about 'When people came to YC'?
Answer:","When people came to YC to speak
at the dinners that first summer, they came in the spirit of someone
coming to address a Boy Scout troop"
"Context:  If you look at the average
outcome rather than the median, you can understand why investors
like them, and why, if they aren't median people, it's a rational
choice for founders to start them. Deals Why do investors like startups so much?  Why are they so hot to
invest in photo-sharing apps, rather than solid money-making
businesses?  Not only for the obvious reason. The test of any investment is the ratio of return to risk.  Startups
pass that test because although they're appallingly risky, the
returns when they do succeed are so high.  But that's not the only
reason investors like startups.  An ordinary slower-growing business
might have just as good a ratio of return to risk, if both were
lower

Question: In the following Paul Graham passage, what does he say about 'The test of any investment'?
Answer:",The test of any investment is the ratio of return to risk
"Context: If we want to get the most out of them, we need to understand these
especially productive people.  What motivates them?  What do they
need to do their jobs?  How do you recognize them? How do you
get them to come and work for you?  And then of course there's the
question, how do you become one? More than Money I know a handful of super-hackers, so I sat down and thought about
what they have in common.  Their defining quality is probably that
they really love to program.  Ordinary programmers write code to pay
the bills.  Great hackers think of it as something they do for fun,
and which they're delighted to find people will pay them for

Question: In the following Paul Graham passage, what does he say about 'What motivates them? What do'?
Answer:","What motivates them?  What do they
need to do their jobs?  How do you recognize them? How do you
get them to come and work for you?  And then of course there's the
question, how do you become one? More than Money I know a handful of super-hackers, so I sat down and thought about
what they have in common"
"Context: [ 7 ] And though there's going to be one investor who gives them the first
check, and his or her help in recruiting other investors will
certainly be welcome, this initial investor will no longer be the
lead in the old sense of managing the round.  The startup will now
do that themselves. There will continue to be lead investors in the sense of investors
who take the lead in advising a startup.  They may also make
the biggest investment.  But they won't always have to be the one
terms are negotiated with, or be the first money in, as they have
in the past.  Standardized paperwork will do away with the need to
negotiate anything except the valuation, and that will get easier
too

Question: In the following Paul Graham passage, what does he say about 'Standardized paperwork will do away'?
Answer:","Standardized paperwork will do away with the need to
negotiate anything except the valuation, and that will get easier
too"
"Context:  Standards are
higher; people are more sympathetic to what you're doing; the kind
of people you want to hire want to live there; supporting industries
are there; the people you run into in chance meetings are in the
same business.  Who knows exactly how these factors combine to boost
startups in Silicon Valley and squish them in Detroit, but it's
clear they do from the number of startups per capita in each. 3. Marginal Niche Most of the groups that apply to Y Combinator suffer from a common
problem: choosing a small, obscure niche in the hope of avoiding
competition. If you watch little kids playing sports, you notice that below a
certain age they're afraid of the ball

Question: In the following Paul Graham passage, what does he say about 'Standards are higher; people are'?
Answer:","Standards are
higher; people are more sympathetic to what you're doing; the kind
of people you want to hire want to live there; supporting industries
are there; the people you run into in chance meetings are in the
same business"
"Context:  Whereas if you're talking to an angel who
invests $20k at a time and you haven't raised any money yet, you
probably want to focus on your least expensive plan. If you're so fortunate as to have to think about the upper limit
on what you should raise, a good rule of thumb is to multiply the
number of people you want to hire times $15k times 18 months.  In
most startups, nearly all the costs are a function of the number
of people, and $15k per month is the conventional total cost
(including benefits and even office space) per person.  $15k per
month is high, so don't actually spend that much.  But it's ok to
use a high estimate when fundraising to add a margin for error

Question: In the following Paul Graham passage, what does he say about 'But it's ok to use'?
Answer:","But it's ok to
use a high estimate when fundraising to add a margin for error"
"Context:  They find the VCs intimidating and inscrutable.
They all ask the same question: who else have you pitched to?  (VCs
are like high school girls: they're acutely aware of their position
in the VC pecking order, and their interest in a company is a
function of the interest other VCs show in it.) One of the VC firms says they want to invest and offers the founders
a term sheet.  A term sheet is a summary of what the deal terms
will be when and if they do a deal; lawyers will fill in the details
later.  By accepting the term sheet, the startup agrees to turn
away other VCs for some set amount of time while this firm does the
""due diligence"" required for the deal

Question: In the following Paul Graham passage, what does he say about ') One of the VC'?
Answer:",") One of the VC firms says they want to invest and offers the founders
a term sheet"
"Context:  In 1995 I started a company to put art galleries
online.  But galleries didn't want to be online.  It's not how the
art business works.  So why did I spend 6 months working on this
stupid idea?  Because I didn't pay attention to users.  I invented
a model of the world that didn't correspond to reality, and worked
from that.  I didn't notice my model was wrong until I tried
to convince users to pay for what we'd built.  Even then I took
embarrassingly long to catch on.  I was attached to my model of the
world, and I'd spent a lot of time on the software.  They had to
want it! Why do so many founders build things no one wants?  Because they
begin by trying to think of startup ideas.  That m.o

Question: In the following Paul Graham passage, what does he say about 'It's not how the art'?
Answer:","It's not how the
art business works"
"Context: Angels are a bit better than VCs, because they usually have startup
experience themselves: VC investors don't know half the time what they are talking
    about and are years behind in their thinking.  A few were great,
    but 95% of the investors we dealt with were unprofessional,
    didn't seem to be very good at business or have any kind of
    creative vision. Angels were generally much better to talk to. Why are founders surprised that VCs are clueless?  I think it's
because they seem so formidable. The reason VCs seem formidable is that it's their profession to.
You get to be a VC by convincing asset managers to trust you with
hundreds of millions of dollars

Question: In the following Paul Graham passage, what does he say about 'Angels are a bit better'?
Answer:","Angels are a bit better than VCs, because they usually have startup
experience themselves: VC investors don't know half the time what they are talking
    about and are years behind in their thinking"
"Context:  Do they want me to do something beyond just
reading some text?  How important is it?  (There obviously has to
be some mechanism to prevent people from saying everything is
important.)  When does it have to be done? This is one of those ideas that's like an irresistible force meeting
an immovable object.  On one hand, entrenched protocols are impossible
to replace

Question: In the following Paul Graham passage, what does he say about ') When does it have'?
Answer:",")  When does it have to be done? This is one of those ideas that's like an irresistible force meeting
an immovable object"
